ID,Institute ,Name,Link,Skill,Issued Date 
1,AWS,AWS Certified Data Analytics – Specialty,https://www.credly.com/badges/bba0bb9b-02cb-4468-a943-6c5d92d5a0e1/linked_in_profile,,
2,AWS,AWS Certified Solutions Architect – Associate,https://www.credly.com/badges/d093c0d5-5324-43a7-b03d-549cf7538355/linked_in_profile,,
3,Coursera,Distributed Computing with Spark SQL,https://www.coursera.org/account/accomplishments/certificate/GUF28MK25HUT,,
4,Coursera,Big Data Modeling and Management Systems,https://www.coursera.org/account/accomplishments/verify/38D5MP3B7XH2,,
5,Coursera,Google Cloud Fundamentals: Core Infrastructure,https://www.coursera.org/account/accomplishments/verify/7WAGDFHSJ23W,,
6,Coursera,Visual Analytics with Tableau,https://www.coursera.org/account/accomplishments/verify/FU6KJBA5NGDG,,
7,Coursera,Essential Design Principles for Tableau,https://www.coursera.org/account/accomplishments/verify/2J9WC7ZDBLN7,,
8,Coursera,SQL for Data Science,https://www.coursera.org/account/accomplishments/certificate/WUWUCMVUDN7G,,
9,Coursera,Postman - Intro to APIs (without coding),https://www.coursera.org/account/accomplishments/verify/MR675VU6X2QS,,
10,Coursera,Programming for Everybody (Getting Started with Python),https://www.coursera.org/account/accomplishments/verify/7MW47JM4EK46,Python,2020-Jan
11,Coursera,AI For Everyone,https://www.coursera.org/account/accomplishments/certificate/LELMHL2CGXLX,,
12,Coursera,Introduction to Big Data,https://www.coursera.org/account/accomplishments/verify/VD5Z8PB6DCQT,,
13,Coursera,Fundamentals of Visualization with Tableau,https://www.coursera.org/account/accomplishments/verify/9JJB6F2LJ9LB,,
14,GraphAcademy,Neo4j Fundamentals,https://graphacademy.neo4j.com/c/a81c45c8-7ead-4cf1-9d92-8617a7ad4b2a/,,
15,linkedin learning,Learning Terraform,https://www.linkedin.com/learning/certificates/08be016209994ec48029bfd17a16e7111343a881f5dc28569dc42984f3dd66de?u=2212217,,
16,linkedin learning,ETL in Python and SQL,https://www.linkedin.com/learning/certificates/50c84dc430465660a41a30b964794323d9f6700ef6d62c537b9bd95843b265e1?u=2212217,,
17,linkedin learning,Learning Apache Airflow,https://www.linkedin.com/learning/certificates/582815dc2d334615ad22ac55eb108d8340cd61e349b22b22a3b00fe17d47fce5?u=2212217,,
18,linkedin learning,Docker: Your First Project,https://www.linkedin.com/learning/certificates/6aa7392a115d8dba21d872cd4fdf8270353d56867eec56ee06db662878ac6bd8?u=2212217,,
19,linkedin learning,Data Science Foundations: Data Engineering,https://www.linkedin.com/learning/certificates/8bb958c7c4192e52d2bfc216cde4e594290b406f86f9ecdddeec9175466f988d?u=2212217,,
20,linkedin learning,Introduction to Data Warehouses,https://www.linkedin.com/learning/certificates/b12cc0e69cfc2bfa900016d6af3d6be1e51e6881a2ad2717c3aec4b72ab752bb?u=2212217,,
21,linkedin learning,R for Data Science: Analysis and Visualization,https://www.linkedin.com/learning/certificates/cbaa561e34c8e0ca069ba6de9a0030d6e706b9162eda44b3f120385e144d8369?u=2212217,,
22,linkedin learning,Apache PySpark by Example,https://www.linkedin.com/learning/certificates/9c48509a2d3146d9021d0f51126a1f1b92603a847ad49535ade77261cf93586e?u=2212217,,
23,linkedin learning,NoSQL Essential Training,https://www.linkedin.com/learning/certificates/6445199e93223fa1cb567e64c043664dc58ceea434242035dd786bcb9074a2fe?u=2212217,,
24,linkedin learning,Programming Foundations: Discrete Mathematics,https://www.linkedin.com/learning/certificates/1aed0e9b0bff3af6d76a36dfc84e01014ebda7c8be423fc20b18c709df1b66da?u=2212217,,
25,linkedin learning,Advanced Snowflake: Deep Dive Cloud Data Warehousing and Analytics,https://www.linkedin.com/learning/certificates/42fb8ab8ac9429fb75b0f022e3cdfa1985cc1a5feb78773b2f6732b6d6e3b6a0?u=2212217,Snowflake,24-Sep
26,linkedin learning,Apache Spark Essential Training: Big Data Engineering,https://www.linkedin.com/learning/certificates/9c126dfe62a77d7f001dcb546d3a394aff60e66379f534aa2aee969206cfbbcb?u=2212217,"Data Engineering , Apache Spark",24-Sep
27,linkedin learning,Building Dynamic Websites using AWS Lambdas,https://www.linkedin.com/learning/certificates/04ba947dd3c8e58a97932231d2fb92fe77664c92048b54c19b26207369f378ce?u=2212217,"Dynamic Websites, AWS Lambda",24-Sep
28,linkedin learning,Getting Started with ECS,https://www.linkedin.com/learning/certificates/fc465cbc484c08303ae15cef89666ab923b63189ca454e6e893998085dc8b732?u=2212217,Amazon ECS,24-Sep
29,linkedin learning,"AWS API Gateway with HTTP, Lambda, DynamoDB, and iOS",https://www.linkedin.com/learning/certificates/da384daff8c6511998486d75428eead967c56b0fa86b7fb21da974d207fd29eb?u=2212217,"REST APIs, API Development, AWS Lambda, Amazon Dynamodb",
30,linkedin learning,AWS CloudFormation for Beginners,https://www.linkedin.com/learning/certificates/ec6a00fe34ee779ccae651f38d0fe1836c1dd2142d8e0fcfd6b30cde05b23b6f?u=2212217,AWS CloudFormation,
31,linkedin learning,Data Pipeline Automation with GitHub Actions Using R and Python,https://www.linkedin.com/learning/certificates/68ac779df6708b8e71fc0adbc4ddc198ef9230fa8444168b20727a17ca5c6939?u=2212217,"Python, R, Github Action",
32,linkedin learning,Learning SnowflakeDB,https://www.linkedin.com/learning/certificates/42faa8f31a7c4a47e3c75a596ca5e31d903232ed654c5a077e77f8e130ec4c38?u=2212217,"Databases, Snowflake",
33,DataCamp,Introduction to Python,https://www.datacamp.com/statement-of-accomplishment/course/2340189a90a5bc858100c24cf90862b5e5c19f6d?raw=1,,
34,linkedin learning,Building a Personalized Chatbot with OpenAI and LangChain,https://www.linkedin.com/learning/certificates/fe601a05c24a59d344390aaac1adfec08eb89d3f48931d3e338b5fca679e3735?u=2212217,"OpenAI Products, Chatbot Development,  LangChain",17-Nov
